Segment,Description,Primary Motivation,Age Range,Income Range,Preferred Brands,Common Features,Buying Frequency
Performance Seekers,"Interested in high-performance vehicles with powerful engines, sporty designs, and advanced driving features.",Performance and power,25-45,"$70,000 - $150,000","BMW, Audi, Mercedes-Benz","Turbocharged engines, sport suspension, high top speeds",Every 3-5 years
Eco-Conscious Drivers,"Prefer environmentally friendly vehicles, such as hybrids or EVs, with low emissions and high fuel efficiency.",Environmental impact,30-50,"$50,000 - $100,000","Tesla, Toyota, Nissan","Electric powertrain, regenerative braking, solar panels",Every 5-7 years
Family-Oriented Consumers,"Look for spacious, safe, and reliable vehicles suitable for family needs, often with features like advanced safety systems.",Family needs and safety,35-55,"$60,000 - $120,000","Honda, Toyota, Ford","Child safety locks, spacious interiors, high safety ratings",Every 5-7 years
Luxury Consumers,"Seek premium, high-end vehicles with luxurious features, comfort, and brand prestige, often favoring brands known for their exclusivity.",Luxury and status,40-60,"$100,000 - $300,000","Lexus, BMW, Mercedes-Benz","Leather interiors, premium sound systems, advanced comfort features",Every 5-10 years
Tech-Savvy Buyers,"Desire the latest technological advancements, connectivity features, and autonomous driving capabilities in their cars.",Technology and innovation,20-40,"$50,000 - $120,000","Tesla, BMW, Audi","Touchscreen interfaces, advanced driver-assistance systems, over-the-air updates",Every 2-4 years
Economical Buyers,"Prioritize affordability, fuel efficiency, and cost-effective maintenance, often looking for cars with high mileage and low ownership costs.",Cost-effectiveness,18-35,"$30,000 - $70,000","Toyota, Honda, Ford","High fuel efficiency, low maintenance costs, reliable performance",Every 7-10 years
Off-Road Enthusiasts,"Enjoy vehicles capable of handling rough terrains, with features like all-wheel drive, higher ground clearance, and durability for outdoor adventures.",Adventure and durability,25-50,"$40,000 - $100,000","Jeep, Subaru, Land Rover","All-terrain tires, skid plates, roof racks",Every 5-7 years
Fleet Buyers,"Focus on purchasing multiple vehicles for business or organizational use, emphasizing reliability, cost-efficiency, and ease of maintenance.",Business requirements,30-60,"$60,000 - $200,000","Ford, Chevrolet, Toyota","Fleet management systems, low total cost of ownership, reliable engines",Based on business needs
